{
  "task": "review_plan",
  "status": "general_only",
  "summary": "В вымышленном плане не упомянута проверка фиксации; это не доказывает ошибку реальной сборки.",
  "checks": [
    {
      "text": "В учебной карточке указан контроль фиксации; добавьте этот пункт в учебный список.",
      "relation": "not_mentioned",
      "evidence_ids": [
        "E_DEMO_01"
      ]
    }
  ],
  "missing_information": [],
  "limitations": [
    "Форматный пример, не инструкция для реального автомобиля."
  ]
}
